{
  "messageId": "77777777-7777-4777-8777-777777777777",
  "messageType": "TransactionsCollectionCompleted",
  "schemaVersion": 1,
  "occurredAt": "2026-09-09T00:00:06Z",
  "syncJobId": "bbbbbbbb-bbbb-4bbb-8bbb-bbbbbbbbbbbb",
  "accountRef": "22222222-2222-4222-8222-222222222222",
  "syncVersion": 2,
  "connectionVersion": 1,
  "causationId": "88888888-8888-4888-8888-888888888888",
  "traceId": "contract-empty-example",
  "data": {
    "fromDate": "2026-09-09",
    "toDate": "2026-09-09",
    "totalChunks": 0,
    "totalItems": 0,
    "collectionCompletedAt": "2026-09-09T00:00:06Z"
  }
}
