{
  "messageId": "11111111-1111-4111-8111-111111111111",
  "messageType": "SyncAccountTransactions",
  "schemaVersion": 1,
  "occurredAt": "2026-09-09T08:00:00Z",
  "syncJobId": "22222222-2222-4222-8222-222222222222",
  "accountRef": "33333333-3333-4333-8333-333333333333",
  "syncVersion": 1,
  "connectionVersion": 1,
  "causationId": null,
  "traceId": "trace-demo-01",
  "data": {
    "connectionRef": "44444444-4444-4444-8444-444444444444",
    "fromDate": "2026-09-01",
    "toDate": "2026-09-09",
    "timeZone": "Asia/Seoul",
    "reason": "USER_REFRESH",
    "deadlineAt": "2026-09-09T08:10:00Z"
  }
}
