{
  "messageId": "55555555-5555-4555-8555-555555555555",
  "messageType": "SyncAccepted",
  "schemaVersion": 1,
  "occurredAt": "2026-09-09T08:00:01Z",
  "syncJobId": "22222222-2222-4222-8222-222222222222",
  "accountRef": "33333333-3333-4333-8333-333333333333",
  "syncVersion": 1,
  "connectionVersion": 1,
  "causationId": "11111111-1111-4111-8111-111111111111",
  "traceId": "trace-demo-01",
  "data": { "acceptedAt": "2026-09-09T08:00:01Z" }
}
