{
  "messageId": "66666666-6666-4666-8666-666666666666",
  "messageType": "TransactionsCollectionCompleted",
  "schemaVersion": 1,
  "occurredAt": "2026-09-09T00:00:06Z",
  "syncJobId": "aaaaaaaa-aaaa-4aaa-8aaa-aaaaaaaaaaaa",
  "accountRef": "22222222-2222-4222-8222-222222222222",
  "syncVersion": 1,
  "connectionVersion": 1,
  "causationId": "11111111-1111-4111-8111-111111111111",
  "traceId": "contract-example",
  "data": {
    "fromDate": "2026-09-01",
    "toDate": "2026-09-09",
    "totalChunks": 1,
    "totalItems": 1,
    "collectionCompletedAt": "2026-09-09T00:00:06Z"
  }
}
